<?xml version="1.0" encoding="UTF-8"?>
<!-- RELEASE CONFIG for public -->

<config xmlns:xsi="http://www.w3.org/2001/XMLSchema-instance" xsi:noNamespaceSchemaLocation="../Config.xsd">
    <!--
    serverAddress       - ip of the XMage server. Set it to "0.0.0.0" for local host or to the IP the server should use
    port                - the port the primary server socket is bound to
    secondaryBindPort   - the port to which the secondary server socket is to be bound. if "-1" is set , an arbitrary port is selected.
    backlogSize         - the preferred number of unaccepted incoming connections allowed at a given time. The actual number may be greater
                          than the specified backlog. When the queue is full, further connection requests are rejected. The JBoss default value is 200
    numAcceptThreads    - the number of threads listening on the ServerSocket. The JBoss default value is 1
    maxPoolSize         - the maximum number of ServerThreads that can exist at any given time. The JBoss default value is 300
    leasePeriod         - To turn on server side connection failure detection of remoting clients, it is necessary to satisfy two criteria.
                          The first is that the client lease period is set and is a value greater than 0. The value is represented in milliseconds.
                          The client lease period can be set by either the 'clientLeasePeriod' attribute within the Connector configuration or by calling the Connector method
    socketWriteTimeout  - All write operations will time out if they do not complete within the configured period.
    maxGameThreads      - Number of games that can be started simultanously on the server
    maxSecondsIdle      - Number of seconds after that a game is auto conceded by the player that was idle for such a time
    minUserNameLength   - minmal allowed length of a user name to connect to the server
    maxUserNameLength   - maximal allowed length of a user name to connect to the server
    userNamePattern     - pattern for user name validity check
    maxAiOpponents      - number of allowed workable AI opponents on the server (draft bots are unlimited)
    saveGameActivated   - allow game save and replay options (not working correctly yet)
    authenticationActivated - "true" = user have to register to signon "false" = user need not to register
    * mail configs only needed if authentication is activated:
    * if mailUser = "" mailgun is used otherwise nativ mail server on the system
    googleAccount       - not supported currently
    mailgunApiKey       - key from the mailgun domain  e.g. = "key-12121111..."
    mailgunDomain       - domain for the mailgun message sending
    mailSmtpHost        - hostname to send the mail
    mailSmtpPort        - port to send the mail
    mailUser            - username used to send the mail
    mailPassword        - passworf of the used user to send the mail
    mailFromAddress     - sender address
    -->
    <server serverAddress="0.0.0.0"
            serverName="mage-server"
            port="17171"
            secondaryBindPort="-1"
            backlogSize="200"
            numAcceptThreads="2"
            maxPoolSize="300"
            leasePeriod="5000"
            socketWriteTimeout="10000"
            maxGameThreads="10"
            maxSecondsIdle="600"
            minUserNameLength="3"
            maxUserNameLength="14"
            invalidUserNamePattern="[^a-z0-9_]"
            minPasswordLength="8"
            maxPasswordLength="100"
            maxAiOpponents="15"
            saveGameActivated="false"
            authenticationActivated="false"
            googleAccount=""
            mailgunApiKey=""
            mailgunDomain=""
            mailSmtpHost=""
            mailSmtpPort=""
            mailUser=""
            mailPassword=""
            mailFromAddress=""
    />
    <playerTypes>
        <playerType name="Human" jar="mage-player-human-${project.version}.jar" className="mage.player.human.HumanPlayer"/>
        <playerType name="Computer - mad" jar="mage-player-ai-mad-${project.version}.jar" className="mage.player.ai.ComputerPlayerControllableProxy"/>
        <playerType name="Computer - draftbot" jar="mage-player-ai-draftbot-${project.version}.jar" className="mage.player.ai.ComputerDraftPlayer"/>
    </playerTypes>
    <gameTypes>
        <gameType name="Two Player Duel" jar="mage-game-twoplayerduel-${project.version}.jar" className="mage.game.TwoPlayerMatch" typeName="mage.game.TwoPlayerDuelType"/>
        <gameType name="Free For All" jar="mage-game-freeforall-${project.version}.jar" className="mage.game.FreeForAllMatch" typeName="mage.game.FreeForAllType"/>
        <gameType name="Commander Two Player Duel" jar="mage-game-commanderduel-${project.version}.jar" className="mage.game.CommanderDuelMatch" typeName="mage.game.CommanderDuelType"/>
        <gameType name="Commander Free For All" jar="mage-game-commanderfreeforall-${project.version}.jar" className="mage.game.CommanderFreeForAllMatch" typeName="mage.game.CommanderFreeForAllType"/>
        <gameType name="Tiny Leaders Two Player Duel" jar="mage-game-tinyleadersduel-${project.version}.jar" className="mage.game.TinyLeadersDuelMatch" typeName="mage.game.TinyLeadersDuelType"/>
        <gameType name="Canadian Highlander Two Player Duel" jar="mage-game-canadianhighlanderduel-${project.version}.jar" className="mage.game.CanadianHighlanderDuelMatch" typeName="mage.game.CanadianHighlanderDuelType"/>
        <gameType name="Penny Dreadful Commander Free For All" jar="mage-game-pennydreadfulcommanderfreeforall-${project.version}.jar" className="mage.game.PennyDreadfulCommanderFreeForAllMatch" typeName="mage.game.PennyDreadfulCommanderFreeForAllType"/>
        <gameType name="Freeform Commander Two Player Duel" jar="mage-game-freeformcommanderduel-${project.version}.jar" className="mage.game.FreeformCommanderDuelMatch" typeName="mage.game.FreeformCommanderDuelType"/>
        <gameType name="Freeform Commander Free For All" jar="mage-game-freeformcommanderfreeforall-${project.version}.jar" className="mage.game.FreeformCommanderFreeForAllMatch" typeName="mage.game.FreeformCommanderFreeForAllType"/>
        <gameType name="Freeform Unlimited Commander" jar="mage-game-freeformunlimitedcommander-${project.version}.jar" className="mage.game.FreeformUnlimitedCommanderMatch" typeName="mage.game.FreeformUnlimitedCommanderType"/>
        <gameType name="Oathbreaker Two Player Duel" jar="mage-game-oathbreakerduel-${project.version}.jar" className="mage.game.OathbreakerDuelMatch" typeName="mage.game.OathbreakerDuelType"/>
        <gameType name="Oathbreaker Free For All" jar="mage-game-oathbreakerfreeforall-${project.version}.jar" className="mage.game.OathbreakerFreeForAllMatch" typeName="mage.game.OathbreakerFreeForAllType"/>
        <gameType name="Brawl Two Player Duel" jar="mage-game-brawlduel-${project.version}.jar" className="mage.game.BrawlDuelMatch" typeName="mage.game.BrawlDuelType"/>
        <gameType name="Brawl Free For All" jar="mage-game-brawlfreeforall-${project.version}.jar" className="mage.game.BrawlFreeForAllMatch" typeName="mage.game.BrawlFreeForAllType"/>
        <gameType name="Momir Basic Two Player Duel" jar="mage-game-momirduel-${project.version}.jar" className="mage.game.MomirDuelMatch" typeName="mage.game.MomirDuelType"/>
        <gameType name="Momir Basic Free For All" jar="mage-game-momirfreeforall-${project.version}.jar" className="mage.game.MomirFreeForAllMatch" typeName="mage.game.MomirFreeForAllType"/>
        <gameType name="Mental Magic Two Player Duel" jar="mage-game-mentalmagic-${project.version}.jar" className="mage.game.MentalMagicDuelMatch" typeName="mage.game.MentalMagicDuelType"/>
        <gameType name="Mental Magic (Same Type) Two Player Duel" jar="mage-game-mentalmagic-${project.version}.jar" className="mage.game.MentalMagicSameTypeDuelMatch" typeName="mage.game.MentalMagicSameTypeDuelType"/>
        <gameType name="Mental Magic Free For All" jar="mage-game-mentalmagic-${project.version}.jar" className="mage.game.MentalMagicFreeForAllMatch" typeName="mage.game.MentalMagicFreeForAllType"/>
        <gameType name="Mental Magic (Same Type) Free For All" jar="mage-game-mentalmagic-${project.version}.jar" className="mage.game.MentalMagicSameTypeFreeForAllMatch" typeName="mage.game.MentalMagicSameTypeFreeForAllType"/>
        <gameType name="Custom Pillar of the Paruns Two Player Duel" jar="mage-game-custompillaroftheparunsduel-${project.version}.jar" className="mage.game.CustomPillarOfTheParunsDuelMatch" typeName="mage.game.CustomPillarOfTheParunsDuelType"/>
    </gameTypes>
    <tournamentTypes>
        <tournamentType name="Constructed Elimination" jar="mage-tournament-constructed-${project.version}.jar" className="mage.tournament.ConstructedEliminationTournament" typeName="mage.tournament.ConstructedEliminationTournamentType"/>
        <tournamentType name="Constructed Swiss" jar="mage-tournament-constructed-${project.version}.jar" className="mage.tournament.ConstructedSwissTournament" typeName="mage.tournament.ConstructedSwissTournamentType"/>
        <tournamentType name="Booster Draft Elimination" jar="mage-tournament-boosterdraft-${project.version}.jar" className="mage.tournament.BoosterDraftEliminationTournament" typeName="mage.tournament.BoosterDraftEliminationTournamentType"/>
        <tournamentType name="Booster Draft Elimination (Cube)" jar="mage-tournament-boosterdraft-${project.version}.jar" className="mage.tournament.BoosterDraftEliminationTournament" typeName="mage.tournament.BoosterDraftEliminationCubeTournamentType"/>
        <tournamentType name="Booster Draft Elimination (Random)" jar="mage-tournament-boosterdraft-${project.version}.jar" className="mage.tournament.RandomBoosterDraftEliminationTournament" typeName="mage.tournament.RandomBoosterDraftEliminationTournamentType"/>